{
  "source_file": "specs/product-requirements.md",
  "summary": "Generated from Product Requirements: Dark Factory MVP.",
  "open_questions": [
    "Should complexity be estimated from text heuristics or set manually after review?",
    "Should generated labels include requirement section slugs by default?"
  ],
  "epics": [
    {
      "title": "Requirements Ingestion",
      "description": "Delivery for product area: Requirements Ingestion",
      "source_sections": [
        "Requirements Ingestion"
      ],
      "tasks": [
        {
          "title": "Support a default requirements file at `specs/product-requirements.md`.",
          "description": "Implement requirement: Support a default requirements file at `specs/product-requirements.md`.",
          "acceptance_criteria": [
            "Requirement implemented: Support a default requirements file at `specs/product-requirements.md`."
          ],
          "dependencies": [],
          "priority": "medium",
          "complexity": "medium",
          "source_sections": [
            "Requirements Ingestion"
          ],
          "subtasks": [
            {
              "title": "Implement Support a default requirements file a...",
              "description": "Deliver code and configuration for: Support a default requirements file at `specs/product-requirements.md`.",
              "acceptance_criteria": [
                "Implementation complete for Support a default requirements file at `specs/product-requirements.md`."
              ],
              "source_sections": [
                "Requirements Ingestion"
              ]
            },
            {
              "title": "Validate Support a default requirements file a...",
              "description": "Validate behavior and quality for: Support a default requirements file at `specs/product-requirements.md`.",
              "acceptance_criteria": [
                "Verification checks pass."
              ],
              "source_sections": [
                "Requirements Ingestion"
              ]
            }
          ]
        },
        {
          "title": "Allow overriding the source path from the CLI.",
          "description": "Implement requirement: Allow overriding the source path from the CLI.",
          "acceptance_criteria": [
            "Requirement implemented: Allow overriding the source path from the CLI."
          ],
          "dependencies": [],
          "priority": "medium",
          "complexity": "medium",
          "source_sections": [
            "Requirements Ingestion"
          ],
          "subtasks": [
            {
              "title": "Implement Allow overriding the source path from...",
              "description": "Deliver code and configuration for: Allow overriding the source path from the CLI.",
              "acceptance_criteria": [
                "Implementation complete for Allow overriding the source path from the CLI."
              ],
              "source_sections": [
                "Requirements Ingestion"
              ]
            },
            {
              "title": "Validate Allow overriding the source path from...",
              "description": "Validate behavior and quality for: Allow overriding the source path from the CLI.",
              "acceptance_criteria": [
                "Verification checks pass."
              ],
              "source_sections": [
                "Requirements Ingestion"
              ]
            }
          ]
        },
        {
          "title": "Preserve section traceability from markdown headings.",
          "description": "Implement requirement: Preserve section traceability from markdown headings.",
          "acceptance_criteria": [
            "Requirement implemented: Preserve section traceability from markdown headings."
          ],
          "dependencies": [],
          "priority": "medium",
          "complexity": "small",
          "source_sections": [
            "Requirements Ingestion"
          ],
          "subtasks": [
            {
              "title": "Implement Preserve section traceability from ma...",
              "description": "Deliver code and configuration for: Preserve section traceability from markdown headings.",
              "acceptance_criteria": [
                "Implementation complete for Preserve section traceability from markdown headings."
              ],
              "source_sections": [
                "Requirements Ingestion"
              ]
            },
            {
              "title": "Validate Preserve section traceability from ma...",
              "description": "Validate behavior and quality for: Preserve section traceability from markdown headings.",
              "acceptance_criteria": [
                "Verification checks pass."
              ],
              "source_sections": [
                "Requirements Ingestion"
              ]
            }
          ]
        }
      ]
    },
    {
      "title": "Plan Generation",
      "description": "Delivery for product area: Plan Generation",
      "source_sections": [
        "Plan Generation"
      ],
      "tasks": [
        {
          "title": "Build a structured plan with epics, tasks, and subtasks.",
          "description": "Implement requirement: Build a structured plan with epics, tasks, and subtasks.",
          "acceptance_criteria": [
            "Requirement implemented: Build a structured plan with epics, tasks, and subtasks."
          ],
          "dependencies": [],
          "priority": "medium",
          "complexity": "small",
          "source_sections": [
            "Plan Generation"
          ],
          "subtasks": [
            {
              "title": "Implement Build a structured plan with epics, t...",
              "description": "Deliver code and configuration for: Build a structured plan with epics, tasks, and subtasks.",
              "acceptance_criteria": [
                "Implementation complete for Build a structured plan with epics, tasks, and subtasks."
              ],
              "source_sections": [
                "Plan Generation"
              ]
            },
            {
              "title": "Validate Build a structured plan with epics, t...",
              "description": "Validate behavior and quality for: Build a structured plan with epics, tasks, and subtasks.",
              "acceptance_criteria": [
                "Verification checks pass."
              ],
              "source_sections": [
                "Plan Generation"
              ]
            }
          ]
        },
        {
          "title": "Capture acceptance criteria from requirement sections.",
          "description": "Implement requirement: Capture acceptance criteria from requirement sections.",
          "acceptance_criteria": [
            "Requirement implemented: Capture acceptance criteria from requirement sections."
          ],
          "dependencies": [],
          "priority": "medium",
          "complexity": "small",
          "source_sections": [
            "Plan Generation"
          ],
          "subtasks": [
            {
              "title": "Implement Capture acceptance criteria from requ...",
              "description": "Deliver code and configuration for: Capture acceptance criteria from requirement sections.",
              "acceptance_criteria": [
                "Implementation complete for Capture acceptance criteria from requirement sections."
              ],
              "source_sections": [
                "Plan Generation"
              ]
            },
            {
              "title": "Validate Capture acceptance criteria from requ...",
              "description": "Validate behavior and quality for: Capture acceptance criteria from requirement sections.",
              "acceptance_criteria": [
                "Verification checks pass."
              ],
              "source_sections": [
                "Plan Generation"
              ]
            }
          ]
        },
        {
          "title": "Identify open questions when details are missing or ambiguous.",
          "description": "Implement requirement: Identify open questions when details are missing or ambiguous.",
          "acceptance_criteria": [
            "Requirement implemented: Identify open questions when details are missing or ambiguous."
          ],
          "dependencies": [],
          "priority": "medium",
          "complexity": "small",
          "source_sections": [
            "Plan Generation"
          ],
          "subtasks": [
            {
              "title": "Implement Identify open questions when details ...",
              "description": "Deliver code and configuration for: Identify open questions when details are missing or ambiguous.",
              "acceptance_criteria": [
                "Implementation complete for Identify open questions when details are missing or ambiguous."
              ],
              "source_sections": [
                "Plan Generation"
              ]
            },
            {
              "title": "Validate Identify open questions when details ...",
              "description": "Validate behavior and quality for: Identify open questions when details are missing or ambiguous.",
              "acceptance_criteria": [
                "Verification checks pass."
              ],
              "source_sections": [
                "Plan Generation"
              ]
            }
          ]
        }
      ]
    },
    {
      "title": "Jira Application",
      "description": "Delivery for product area: Jira Application",
      "source_sections": [
        "Jira Application"
      ],
      "tasks": [
        {
          "title": "Provide a review-first workflow before Jira mutation.",
          "description": "Implement requirement: Provide a review-first workflow before Jira mutation.",
          "acceptance_criteria": [